
MySQL queries for employee pay roll
----------------------------------------------------------------
#UC->1
----------------------------------------------------------------
mysql> create database Payroll_Service;
Query OK, 1 row affected (0.67 sec)

mysql> show databases;
+--------------------+
| Database           |
+--------------------+
| information_schema |
| mysql              |
| payroll_service    |
| performance_schema |
| person_info        |
| sys                |
+--------------------+
6 rows in set (0.46 sec)

mysql> use payroll_service;
Database changed
----------------------------------------------------------------
#UC->2
----------------------------------------------------------------
mysql> use payroll_service;
Database changed
mysql> create table employee_payroll(
    -> EmpId int unsigned not null auto_increment,
    -> EmpName varchar(200) not null,
    -> Salary double not null,
    -> EmpStart Date not null,
    -> primary key (EmpId)
    -> );
Query OK, 0 rows affected (0.16 sec)

mysql> desc employee_payroll;
+----------+--------------+------+-----+---------+----------------+
| Field    | Type         | Null | Key | Default | Extra          |
+----------+--------------+------+-----+---------+----------------+
| EmpId    | int unsigned | NO   | PRI | NULL    | auto_increment |
| EmpName  | varchar(200) | NO   |     | NULL    |                |
| Salary   | double       | NO   |     | NULL    |                |
| EmpStart | date         | NO   |     | NULL    |                |
+----------+--------------+------+-----+---------+----------------+
4 rows in set (0.01 sec)
----------------------------------------------------------------
#UC->3
----------------------------------------------------------------
mysql> insert into employee_payroll (EmpName,Salary,EmpStart) values ("rahul",3500000.0,'1994-06-27');
Query OK, 1 row affected (0.17 sec)

mysql> insert into employee_payroll(EmpName, Salary, EmpStart)values('shiva',2000000.00,'2019-11-13');
Query OK, 1 row affected (0.20 sec)

mysql> insert into employee_payroll(EmpName, Salary, EmpStart)values('abhilash',1800000.00,'2019-11-13');
Query OK, 1 row affected (0.06 sec)

mysql> insert into employee_payroll(EmpName, Salary, EmpStart)values('zeeshan',4800000.00,'2015-01-23');
Query OK, 1 row affected (0.13 sec)

insert into employee_payroll(EmpName, Salary, EmpStart)values('shivani',1000000.00,'2019-05-03');
Query OK, 1 row affected (0.10 sec)

mysql> insert into employee_payroll(EmpName, Salary, EmpStart)values('vaishnavi',9000000.00,'2020-06-18');
Query OK, 1 row affected (0.11 sec)

----------------------------------------------------------------
#UC->4
----------------------------------------------------------------
 select * from employee_payroll;
+-------+-----------+---------+------------+
| EmpId | EmpName   | Salary  | EmpStart   |
+-------+-----------+---------+------------+
|     1 | rahul     | 3500000 | 1994-06-27 |
|     2 | shiva     | 2000000 | 2019-11-13 |
|     3 | abhilash  | 1800000 | 2019-11-13 |
|     4 | zeeshan   | 4800000 | 2015-01-23 |
|     5 | shivani   | 1000000 | 2019-05-03 |
|     6 | vaishnavi | 9000000 | 2020-06-18 |
+-------+-----------+---------+------------+
6 rows in set (0.00 sec)

----------------------------------------------------------------
#UC->5
----------------------------------------------------------------
mysql> SELECT salary FROM employee_payroll where EmpName  = 'rahul';
+---------+
| salary  |
+---------+
| 3500000 |
+---------+
1 row in set (0.02 sec)

mysql> SELECT salary FROM employee_payroll WHERE EmpStart BETWEEN CAST('2019-01-23' as date) and date (now());
+---------+
| salary  |
+---------+
| 2000000 |
| 1800000 |
| 1000000 |
| 9000000 |
+---------+
4 rows in set (0.00 sec)

----------------------------------------------------------------
#UC->6
----------------------------------------------------------------
mysql> ALTER TABLE employee_payroll ADD gender CHAR(1) AFTER EmpName;
Query OK, 0 rows affected (3.04 sec)
Records: 0  Duplicates: 0  Warnings: 0

mysql> UPDATE employee_payroll set gender = 'F' where EmpName = 'shivani' or EmpName = 'vaishnavi';
Query OK, 2 rows affected (0.16 sec)
Rows matched: 2  Changed: 2  Warnings: 0

UPDATE employee_payroll set gender = 'M' where EmpName = 'rahul' or EmpName = 'shiva' or EmpName = 'abhilash' or EmpName = 'zeeshan';
Query OK, 4 rows affected (0.07 sec)
Rows matched: 4  Changed: 4  Warnings: 0

mysql> select * from employee_payroll;
+-------+-----------+--------+---------+------------+
| EmpId | EmpName   | gender | Salary  | EmpStart   |
+-------+-----------+--------+---------+------------+
|     1 | rahul     | M      | 3500000 | 1994-06-27 |
|     2 | shiva     | M      | 2000000 | 2019-11-13 |
|     3 | abhilash  | M      | 1800000 | 2019-11-13 |
|     4 | zeeshan   | M      | 4800000 | 2015-01-23 |
|     5 | shivani   | F      | 1000000 | 2019-05-03 |
|     6 | vaishnavi | F      | 9000000 | 2020-06-18 |
+-------+-----------+--------+---------+------------+
6 rows in set (0.02 sec)

----------------------------------------------------------------
#UC->7
----------------------------------------------------------------

mysql> SELECT gender, SUM(Salary) FROM employee_payroll GROUP BY gender;
+--------+-------------+
| gender | SUM(Salary) |
+--------+-------------+
| M      |    12100000 |
| F      |    10000000 |
+--------+-------------+
2 rows in set (0.04 sec)

mysql> SELECT gender, AVG(Salary) FROM employee_payroll GROUP BY gender;
+--------+-------------+
| gender | AVG(Salary) |
+--------+-------------+
| M      |     3025000 |
| F      |     5000000 |
+--------+-------------+
2 rows in set (0.01 sec)

mysql> SELECT gender, MIN(Salary) FROM employee_payroll GROUP BY gender;
+--------+-------------+
| gender | MIN(Salary) |
+--------+-------------+
| M      |     1800000 |
| F      |     1000000 |
+--------+-------------+
2 rows in set (0.02 sec)

mysql> SELECT gender, MAX(Salary) FROM employee_payroll GROUP BY gender;
+--------+-------------+
| gender | MAX(Salary) |
+--------+-------------+
| M      |     4800000 |
| F      |     9000000 |
+--------+-------------+
2 rows in set (0.00 sec)

mysql> SELECT gender, COUNT(EmpName) FROM employee_payroll GROUP BY gender;
+--------+----------------+
| gender | COUNT(EmpName) |
+--------+----------------+
| M      |              4 |
| F      |              2 |
+--------+----------------+
2 rows in set (0.01 sec)

----------------------------------------------------------------
#UC->8
----------------------------------------------------------------

mysql> ALTER TABLE employee_payroll ADD PhoneNumber VARCHAR(250) AFTER EmpName;
Query OK, 0 rows affected (2.50 sec)
Records: 0  Duplicates: 0  Warnings: 0

mysql> ALTER TABLE employee_payroll ADD Address VARCHAR(250) AFTER PhoneNumber;
Query OK, 0 rows affected (1.69 sec)
Records: 0  Duplicates: 0  Warnings: 0

mysql> ALTER TABLE employee_payroll ADD Department VARCHAR(250) NOT NULL AFTER Address;
Query OK, 0 rows affected (1.33 sec)
Records: 0  Duplicates: 0  Warnings: 0

mysql> ALTER TABLE employee_payroll CHANGE COLUMN Address Address  VARCHAR(250) DEFAULT 'DEFAULT';
Query OK, 0 rows affected (0.15 sec)
Records: 0  Duplicates: 0  Warnings: 0

mysql> DESCRIBE employee_payroll;
+-------------+--------------+------+-----+---------+----------------+
| Field       | Type         | Null | Key | Default | Extra          |
+-------------+--------------+------+-----+---------+----------------+
| EmpId       | int unsigned | NO   | PRI | NULL    | auto_increment |
| EmpName     | varchar(200) | NO   |     | NULL    |                |
| PhoneNumber | varchar(250) | YES  |     | NULL    |                |
| Address     | varchar(250) | YES  |     | DEFAULT |                |
| Department  | varchar(250) | NO   |     | NULL    |                |
| gender      | char(1)      | YES  |     | NULL    |                |
| Salary      | double       | NO   |     | NULL    |                |
| EmpStart    | date         | NO   |     | NULL    |                |
+-------------+--------------+------+-----+---------+----------------+
8 rows in set (0.03 sec)

----------------------------------------------------------------
#UC->9
----------------------------------------------------------------
mysql> ALTER TABLE employee_payroll RENAME COLUMN Salary TO BasicPay;
Query OK, 0 rows affected (0.24 sec)
Records: 0  Duplicates: 0  Warnings: 0

mysql> ALTER TABLE employee_payroll
    -> ADD Deductions Double NOT NULL AFTER BasicPay,
    -> ADD TaxablePay Double NOT NULL AFTER Deductions,
    -> ADD IncomeTax Double NOT NULL AFTER TaxablePay,
    -> ADD NetPay Double NOT NULL AFTER IncomeTax;
Query OK, 0 rows affected (5.92 sec)
Records: 0  Duplicates: 0  Warnings: 0

mysql> desc Employee_payroll;
+-------------+--------------+------+-----+---------+----------------+
| Field       | Type         | Null | Key | Default | Extra          |
+-------------+--------------+------+-----+---------+----------------+
| EmpId       | int unsigned | NO   | PRI | NULL    | auto_increment |
| EmpName     | varchar(200) | NO   |     | NULL    |                |
| PhoneNumber | varchar(250) | YES  |     | NULL    |                |
| Address     | varchar(250) | YES  |     | DEFAULT |                |
| Department  | varchar(250) | NO   |     | NULL    |                |
| gender      | char(1)      | YES  |     | NULL    |                |
| BasicPay    | double       | NO   |     | NULL    |                |
| Deductions  | double       | NO   |     | NULL    |                |
| TaxablePay  | double       | NO   |     | NULL    |                |
| IncomeTax   | double       | NO   |     | NULL    |                |
| NetPay      | double       | NO   |     | NULL    |                |
| EmpStart    | date         | NO   |     | NULL    |                |
+-------------+--------------+------+-----+---------+----------------+
12 rows in set (0.06 sec)

----------------------------------------------------------------
#UC->10
----------------------------------------------------------------
mysql> INSERT INTO employee_payroll(EmpName, Department, gender, BasicPay, Deductions, TaxablePay, IncomeTax, NetPay, EmpStart) VALUES
    -> ('Terisa','Marketing','F',390000.0,80000.0,3000.0,1800.0,305200.0,'2018-01-03'),
    -> ('Terisa','Sales','F',490000.0,80000.0,3000.0,1800.0,405200.0,'2019-04-04');
Query OK, 2 rows affected (0.32 sec)
Records: 2  Duplicates: 0  Warnings: 0

mysql> select * from Employee_payroll;
+-------+-----------+-------------+---------+------------+--------+----------+------------+------------+-----------+--------+------------+
| EmpId | EmpName   | PhoneNumber | Address | Department | gender | BasicPay | Deductions | TaxablePay | IncomeTax | NetPay | EmpStart   |
+-------+-----------+-------------+---------+------------+--------+----------+------------+------------+-----------+--------+------------+
|     1 | rahul     | NULL        | NULL    |            | M      |  3500000 |          0 |          0 |         0 |      0 | 1994-06-27 |
|     2 | shiva     | NULL        | NULL    |            | M      |  2000000 |          0 |          0 |         0 |      0 | 2019-11-13 |
|     3 | abhilash  | NULL        | NULL    |            | M      |  1800000 |          0 |          0 |         0 |      0 | 2019-11-13 |
|     4 | zeeshan   | NULL        | NULL    |            | M      |  4800000 |          0 |          0 |         0 |      0 | 2015-01-23 |
|     5 | shivani   | NULL        | NULL    |            | F      |  1000000 |          0 |          0 |         0 |      0 | 2019-05-03 |
|     6 | vaishnavi | NULL        | NULL    |            | F      |  9000000 |          0 |          0 |         0 |      0 | 2020-06-18 |
|     7 | Terisa    | NULL        | DEFAULT | Marketing  | F      |   390000 |      80000 |       3000 |      1800 | 305200 | 2018-01-03 |
|     8 | Terisa    | NULL        | DEFAULT | Sales      | F      |   490000 |      80000 |       3000 |      1800 | 405200 | 2019-04-04 |
+-------+-----------+-------------+---------+------------+--------+----------+------------+------------+-----------+--------+------------+
8 rows in set (0.07 sec)

----------------------------------------------------------------
#UC->11
----------------------------------------------------------------
mysql> CREATE TABLE company(
    -> CompanyId      INT PRIMARY KEY,
    -> CompanyName      VARCHAR(250) NOT NULL
    -> );
Query OK, 0 rows affected (3.85 sec)

mysql> CREATE TABLE employee(
    ->  Id INT unsigned NOT NULL AUTO_INCREMENT PRIMARY KEY,
    ->  CompanyId INT REFERENCES company(CompanyId),
    ->  Name           VARCHAR(200) NOT NULL,
    ->  PhoneNumber VARCHAR(20) NOT NULL,
    ->  Address VARCHAR(50) NOT NULL DEFAULT 'DEFAULT',
    ->  Gender CHAR(1) NOT NULL
    -> );
Query OK, 0 rows affected (0.70 sec)

mysql> CREATE TABLE payroll(
    ->  Id INT REFERENCES employee(Id),
    ->  BasicPay DOUBLE NOT NULL,
    ->  Deductions DOUBLE NOT NULL,
    ->  TaxablePay DOUBLE NOT NULL,
    ->  IncomeTax DOUBLE NOT NULL,
    ->  Net_pay DOUBLE NOT NULL
    -> );
Query OK, 0 rows affected (0.90 sec)

mysql> CREATE TABLE department(
    ->  DeptId INT PRIMARY KEY,
    ->  DeptName VARCHAR(50) NOT NULL
    -> );
Query OK, 0 rows affected (0.74 sec)

mysql> CREATE TABLE employee_Department(
    ->  EmpId   INT REFERENCES employee(Id),
    ->  DeptId  INT REFERENCES department(DeptId)
    -> );
Query OK, 0 rows affected (0.65 sec)

mysql> show tables;
+---------------------------+
| Tables_in_payroll_service |
+---------------------------+
| company                   |
| department                |
| employee                  |
| employee_department       |
| employee_payroll          |
| payroll                   |
+---------------------------+
6 rows in set (0.27 sec)

----------------------------------------------------------------
#UC->12
----------------------------------------------------------------
mysql> INSERT INTO company VALUES
    -> (1,"INFOSYS"),
    -> (2,"WIPRO");
Query OK, 1 row affected (0.12 sec)

mysql> SELECT * from company;
+-----------+-------------+
| CompanyId | CompanyName |
+-----------+-------------+
|         1 | INFOSYS     |
|         2 | WIPRO       |
+-----------+-------------+
2 rows in set (0.02 sec)

mysql> INSERT INTO employee(CompanyId, EmpName, PhoneNumber, Address, Gender) VALUES
    -> (1, 'rahul', '9876543210', 'abc', 'M' ),
    -> (1, 'Terisa', '8665443211', 'bca', 'F' ),
    -> (1, 'shivani', '9976543212', 'cab', 'F'),
    -> (2, 'shiva', '9876543210', 'def', 'M' ),
    -> (2, 'abhilash', '8665443211', 'ghi', 'M' ),
    -> (2, 'vaishnavi', '9976543212', 'mnl', 'F')
    -> ;
Query OK, 3 rows affected (0.14 sec)
Records: 3  Duplicates: 0  Warnings: 0

mysql> select * from employee;
+----+-----------+-----------+-------------+---------+--------+
| Id | CompanyId | EmpName   | PhoneNumber | Address | Gender |
+----+-----------+-----------+-------------+---------+--------+
|  1 |         1 | rahul     | 9876543210  | abc     | M      |
|  2 |         1 | Terisa    | 8665443211  | bca     | F      |
|  3 |         1 | shivani   | 9976543212  | cab     | F      |
|  4 |         2 | shiva     | 9876543210  | def     | M      |
|  5 |         2 | abhilash  | 8665443211  | ghi     | M      |
|  6 |         2 | vaishnavi | 9976543212  | mnl     | F      |
+----+-----------+-----------+-------------+---------+--------+
6 rows in set (0.01 sec)

mysql> INSERT INTO department VALUES
    -> (1,'Sales'),
    -> (2,'Marketing'),
    -> (3,'HR');
Query OK, 3 rows affected (0.19 sec)
Records: 3  Duplicates: 0  Warnings: 0

mysql> select * from department;
+--------+-----------+
| DeptId | DeptName  |
+--------+-----------+
|      1 | Sales     |
|      2 | Marketing |
|      3 | HR        |
+--------+-----------+
3 rows in set (0.00 sec)

mysql> INSERT INTO payroll VALUES
    -> (1,6000,400,3500,700,8000),
    -> (2,9000,100,2400,400,2500),
    -> (3,7000,600,5500,900,3000),
    -> (4,12000,1400,3500,600,6000),
    -> (5,19000,1100,2400,200,3000),
    -> (6,17000,1600,5500,400,2500);
Query OK, 3 rows affected (0.24 sec)
Records: 3  Duplicates: 0  Warnings: 0

mysql> select * from payroll;
+------+----------+------------+------------+-----------+---------+
| Id   | BasicPay | Deductions | TaxablePay | IncomeTax | Net_pay |
+------+----------+------------+------------+-----------+---------+
|    1 |     6000 |        400 |       3500 |       700 |    8000 |
|    2 |     9000 |        100 |       2400 |       400 |    2500 |
|    3 |     7000 |        600 |       5500 |       900 |    3000 |
|    4 |    12000 |       1400 |       3500 |       600 |    6000 |
|    5 |    19000 |       1100 |       2400 |       200 |    3000 |
|    6 |    17000 |       1600 |       5500 |       400 |    2500 |
+------+----------+------------+------------+-----------+---------+
6 rows in set (0.08 sec)

mysql> INSERT INTO employee_department VALUES
    -> (1,1),
    -> (2,2),
    -> (3,3),
    -> (4,1),
    -> (5,2),
    -> (6,3);
Query OK, 3 rows affected (0.28 sec)
Records: 3  Duplicates: 0  Warnings: 0

mysql> select * from employee_department;
+-------+--------+
| EmpId | DeptId |
+-------+--------+
|     1 |      1 |
|     2 |      2 |
|     3 |      3 |
|     4 |      1 |
|     5 |      2 |
|     6 |      3 |
+-------+--------+
6 rows in set (0.00 sec)
